{
  "id": "mm_fp8_blockscale@1.0.0",
  "name": "fp8 block-scale dense GEMM",
  "version": "1.0.0",
  "kernel": "mm_fp8_blockscale",
  "op": {
    "signature": "out[M,N] = (A_deq) @ (B_deq).T  with A per-token-group fp8 e4m3, B per-block fp8 e4m3",
    "canonical_op": "gemm",
    "fusions": ["fp8_blockscale_dequant"]
  },
  "inputs": {
    "a_fp8":    { "dtype": ["fp8"], "layout": "row_major", "rank": 2, "shape_symbols": ["M", "K"] },
    "a_scales": { "dtype": ["fp32"], "layout": "row_major", "rank": 2, "shape_symbols": ["M", "kt"] },
    "b_fp8":    { "dtype": ["fp8"], "layout": "row_major", "rank": 2, "shape_symbols": ["N", "K"] },
    "b_scales": { "dtype": ["fp32"], "layout": "row_major", "rank": 2, "shape_symbols": ["nt", "kt"] }
  },
  "outputs": {
    "out": { "dtype": ["bf16", "fp32"], "layout": "row_major", "rank": 2, "shape_symbols": ["M", "N"] }
  },
  "constraints": [
    "K % 128 == 0",
    "N % 128 == 0",
    "kt == K // 128",
    "nt == N // 128"
  ],
  "preconditions": [
    "block == 128 (DeepSeek block-scale convention); operands already quantized to fp8 e4m3",
    "a_fp8, a_scales, b_fp8, b_scales contiguous"
  ],
  "numerics": {
    "reference": "xkernels.ops.gemm.reference:mm_fp8_blockscale_ref",
    "rtol": 1e-2,
    "atol": 1e-1,
    "reduce_dtype": "fp32",
    "by_dtype": {
      "bf16": { "rtol": 0.016, "atol": 1e-1 },
      "fp32": { "rtol": 1e-3, "atol": 1e-3 }
    },
    "cross_backend_rtol": 0.02,
    "notes": "Parity target is dequant-then-fp32-matmul. Both backends consume identical fp8 operands and dequant identically, so fp32-dot divergence is accumulation ORDER only (empirically max_rel ~2e-5 on GPU vs torch CUDA matmul, well inside the fp32 rtol 1e-3).\n\nbf16 rtol = 0.016 (CALIBRATED 2026-06-29, not hand-waved): the canonical bar is torch.testing's per-dtype default for bfloat16 = (rtol=0.016, atol=1e-5) (torch 2.12, torch/testing/_comparison.py), itself derived from the bf16 mantissa width: 7 mantissa bits -> 2^-7 ~= 7.8e-3 per ULP, and TWO independently-rounded bf16 outputs of slightly-different fp32 reductions can straddle a rounding boundary by up to 2 ULP (1.56e-2 rel at an O(1) value). The previous 1e-2 covered 1 ULP but false-failed the 2-ULP boundary case (e.g. bf16 M=128 N=512 K=512 at seed 1729: fp32 agreement was 2.3e-5 -- excellent -- yet after the cast rel hit 1.36e-2). Proven a boundary artifact, not accumulation error: scripts/m128_bf16_rootcause.py shows EVERY valid fp32 reduction (Kahan, naive, blocked, tree) lands at exactly 1-2 bf16-ULP vs torch after the cast. atol kept at 1e-1 (the fp8 block-scale dynamic range).\n\ncross_backend_rtol = 0.02: raised from 1e-2 to stay >= the bf16 single-backend rtol (0.016), preserving the library.md Sec.5.4 invariant (cross-backend must not be tighter than any single-backend rtol, else a backend that passes verify would false-fail parity on the same bf16 boundary straddle). Still looser than the fp32 single-backend rtol would want, but cross-backend is intentionally loose to absorb cross-vendor accumulation-order differences (Sec.5.4); per-backend verify (fp32 rtol 1e-3) is the gate that catches real fp32 drift. out_dtype follows the point dtype."
  },
  "shape_sweep": "mm_fp8_blockscale",
  "composes_with": []
}
