{
  "id": "silu_and_mul@1.0.0",
  "name": "SiLU-gated multiply (SwiGLU activation)",
  "version": "1.0.0",
  "kernel": "silu_and_mul",
  "op": {
    "signature": "out[M,K] = silu(gate[M,K]) * up[M,K]",
    "canonical_op": "activation",
    "fusions": []
  },
  "inputs": {
    "gate": {
      "dtype": [
        "fp32",
        "bf16",
        "fp16"
      ],
      "rank": 2,
      "layout": "row_major",
      "shape_symbols": [
        "M",
        "K"
      ]
    },
    "up": {
      "dtype": [
        "fp32",
        "bf16",
        "fp16"
      ],
      "rank": 2,
      "layout": "row_major",
      "shape_symbols": [
        "M",
        "K"
      ]
    }
  },
  "outputs": {
    "out": {
      "dtype": [
        "fp32",
        "bf16",
        "fp16"
      ],
      "rank": 2,
      "layout": "row_major",
      "shape_symbols": [
        "M",
        "K"
      ]
    }
  },
  "constraints": [
    "dtype(gate) == dtype(up)"
  ],
  "preconditions": [
    "gate, up share shape [M,K] and are contiguous row-major",
    "for the flashinfer one-tensor [M,2K] form: gate, up = x.chunk(2, dim=-1)"
  ],
  "numerics": {
    "reference": "xkernels.vkl.auto:silu_and_mul",
    "rtol": 0.016,
    "atol": 0.01,
    "reduce_dtype": "fp32",
    "cross_backend_rtol": 0.016,
    "by_dtype": {
      "fp32": {
        "rtol": 1e-05,
        "atol": 1e-06
      },
      "bf16": {
        "rtol": 0.016,
        "atol": 0.01
      },
      "fp16": {
        "rtol": 0.016,
        "atol": 0.01
      }
    },
    "notes": "Pure pointwise gated activation. Nonlinearity in promoted (fp32) precision, cast to out dtype; only divergence is that final cast."
  },
  "shape_sweep": "silu_and_mul",
  "composes_with": []
}
